{
  "id": "domain.runtime",
  "version": 1,
  "title": "Runtime and Operations",
  "status": "active",
  "owners": ["Arpan Ghosh"],
  "updated_at": "2026-03-24T00:00:00Z",
  "verified_from": [
    { "path": "README.md", "note": "Operational runtime and env vars" },
    { "path": "docker-compose.yml", "note": "Deployment defaults" },
    { "path": "docker-compose-build.yml", "note": "Source-build deployment defaults" }
  ],
  "content": {
    "node": "18+",
    "rust": "stable",
    "profiles": "Per-profile DB/config/session isolation",
    "env_vars": [
      "DATA_DIR",
      "RUST_LOG",
      "DJI_API_KEY",
      "SYNC_LOGS_PATH",
      "SYNC_INTERVAL",
      "KEEP_UPLOADED_FILES",
      "PROFILE_CREATION_PASS",
      "SESSION_TTL_HOURS"
    ]
  }
}
